event_date,event,entities,reported_metric,market_health_signal,source
2016,Trade Coin Club established,Trade Coin Club; Douver Torres Braga,Program promised profits from proprietary crypto asset trading software and commissions for recruiting investors,Bot claims and referral rewards should be separated from verified trading P&L,SEC complaint against Braga Paradise and Taylor
2016-12-16,Kickoff marketing presentation,Douver Torres Braga; Trade Coin Club,"Marketing materials claimed a cryptocurrency trading robot, millions of microtransactions every second, and stop-loss protection for minimum daily profits",Bot-throughput and guaranteed-return claims require order and fill reconciliation,SEC complaint against Braga Paradise and Taylor
2016-2018,Investor bitcoin raised,Trade Coin Club,"More than 82000 bitcoin valued at 295 million USD from more than 100000 investors worldwide",Large inflows require proof that funds reached trading venues and generated returns,SEC press release 2022-201
2016-2018,Back Office account displays,Trade Coin Club,Website displayed account information and purported trading profits to investors,Private dashboard values can function as synthetic market data,SEC complaint against Braga Paradise and Taylor
2016-2018,Withdrawal funding pattern,Trade Coin Club; Douver Torres Braga,SEC alleged withdrawals were paid solely with investor deposits and not from crypto asset trading activity,Source-of-funds analysis can distinguish trading profits from Ponzi-style redemptions,SEC press release 2022-201
2016-2018,Promoter compensation,Braga; Paradise; Taylor; Tetreault,"Braga allegedly received at least 8396 BTC; Paradise 238 BTC; Taylor 735 BTC; Tetreault 158 BTC",Promoter payouts should be reconciled against customer deposits and trading income,SEC press release 2022-201
2018-early,Bitcoin redemption changes,Trade Coin Club,Program allegedly stopped bitcoin redemptions and required withdrawals in TCoin,Forced conversion into a platform-issued asset is a liquidity-warning signal,SEC complaint against Braga Paradise and Taylor
2022-11-04,SEC public charges,SEC; Braga; Paradise; Taylor; Tetreault,SEC announced charges tied to a fraudulent crypto Ponzi scheme involving purported bot trading,Enforcement filings challenged the trading-performance narrative,SEC press release 2022-201
