event_date,event,entities,reported_metric,market_health_signal,source
2022-03 onward,Website network allegedly begins,GA Investors; John Does Nos. 1-4,SEC complaint alleged investments were offered through dozens of fraudulent websites,Similar templates and claims could propagate across many domains,SEC complaint
2022-10 to 2022-11,Direct messages to Massachusetts investor,GA Investors; Brian K. Stafford persona; Massachusetts investor,SEC complaint alleged use of an alias and false legitimacy claims,Off-platform identity claims needed independent verification,SEC complaint
2022-11,Initial investment and later larger transfers,GA Investors; Massachusetts investor,SEC complaint alleged approximately 2400 USD initial investment and about 47500 USD later investments,Platform onboarding required crypto purchases and wallet transfers,SEC complaint
2022-11 to 2022-12,Partial withdrawals allegedly allowed,GA Investors; Massachusetts investor,SEC complaint alleged approximately 15000 USD in withdrawals before later blocks,Early withdrawals could operate as confidence signals,SEC complaint
2022-12 to 2023-01,Withdrawal blocks and deposit demands alleged,GA Investors; Massachusetts investor,SEC complaint alleged account suspension and demands for additional deposits to unfreeze funds,Withdrawal gating was a key fraud signal,SEC complaint
2023-04-19,Original GA-Investors.org inaccessible,GA-Investors.org; GA-Investor.org,SEC complaint said original site was inaccessible while related sites remained active,Domain rotation could preserve the scheme after one site disappeared,SEC complaint
2023-05-11,SEC emergency action announced,SEC; GA Investors; John Does Nos. 1-4,SEC announced charges over fraudulent offerings including crypto asset mining pools,Enforcement action documented alleged false return and impersonation signals,SEC litigation release
