signal,observation,market_health_relevance,source
Affected users,"2,367 unique liquidity provider addresses were identified by KyberSwap as affected users.","Shows that the manipulation harmed a broad LP set rather than only an isolated pool counterparty.","https://blog.kyberswap.com/post-mortem-kyberswap-elastic-exploit/"
Affected assets,"KyberSwap estimated total affected assets at 56,197,284.26 USD, including 55,234,535.17 USD taken from pools.","Measures realized market-health impact after the AMM state was distorted.","https://blog.kyberswap.com/post-mortem-kyberswap-elastic-exploit/"
Primary exploiter amount,"KyberSwap attributed 48,671,786.84 USD of taken assets to the primary exploiter.","Separates the original manipulation from copycat or front-run extraction.","https://blog.kyberswap.com/post-mortem-kyberswap-elastic-exploit/"
Mimicking bots amount,"KyberSwap attributed 6,562,748.33 USD of taken assets to mimicking bots.","Shows that once the manipulation became observable, other actors could replicate or front-run it.","https://blog.kyberswap.com/post-mortem-kyberswap-elastic-exploit/"
Pool and chain breadth,"The US IRS-CI release alleged approximately 48.8 million USD stolen from 77 KyberSwap pools on six public blockchains.","Cross-chain repetition is a red flag for systemic AMM-market fragility rather than one-off venue noise.","https://www.irs.gov/pub/irs-ci/j5-media-release-2-10-25.pdf"
Flash-loan notional,"SharkTeam described an attack transaction that borrowed 10,000 wstETH before manipulating a KyberSwap pool.","Large temporary notional relative to local pool liquidity is a common precursor to artificial price formation.","https://sharkteam.org/report/analysis/20231127001A_en.pdf"
Extreme price displacement,"SharkTeam reported a wstETH price movement from about 1.05 ETH to 0.000015257 during setup in one analyzed pool.","A movement of this scale is inconsistent with ordinary market-making and should trigger venue-health monitoring.","https://sharkteam.org/report/analysis/20231127001A_en.pdf"
Tick-boundary precision,"KyberSwap described a calculated swap amount that exploited a rounding gap near a tick boundary and corrupted pool state.","Near-boundary concentrated-liquidity swaps are a useful metric for detecting manipulation attempts in CLMM venues.","https://blog.kyberswap.com/post-mortem-kyberswap-elastic-exploit/"
