event_date,event,entities,reported_metric,market_health_signal,source
2017-07,Forcount memberships promoted,Forcount Trader Systems; Francisley Valdevino Da Silva,SEC said memberships promised exposure to profits from crypto asset trading and mining,Membership returns required actual trading and mining proof,SEC press release 2022-227
2018-04,Withdrawal problems begin,Forcount; investors,DOJ said victims attempting withdrawals had difficulty around April 2018,Withdrawal friction challenged displayed return balances,DOJ charging release
2017-2020,Fundraising period described by SEC,Forcount; promoters,SEC said Forcount raised more than 8.4 million USD from hundreds of retail investors,Deposit growth required separation from market-generated profits,SEC press release 2022-227
2017-2020,Referral program promoted,Forcount; promoters,SEC said the referral program incentivized recruiting new victims,Recruitment economics can imitate investment performance,SEC press release 2022-227
2018-2021,Mindexcoin offered as complaints mounted,Forcount; Mindexcoin,DOJ said Mindexcoin was claimed to gain value when accepted for goods and services,Token issuance reframed redemption stress as future utility,DOJ charging release
2021,Payments stop,Forcount,DOJ said Forcount had stopped making payments to victims by about 2021,Displayed returns failed redemption tests,DOJ charging release
2022-12-14,SEC civil charges announced,SEC; Forcount; Da Silva; Tacuri; Perez; Coronado,SEC charged a fraudulent crypto asset pyramid scheme targeting retail investors,Civil case challenged membership return and referral claims,SEC press release 2022-227
2022-12-14,DOJ criminal charges announced,DOJ; Francisley Da Silva; Juan Tacuri; Antonia Perez Hernandez,DOJ announced criminal charges tied to Forcount and related conduct,Criminal allegations linked return portals withdrawal issues and proprietary tokens,DOJ charging release
