event_date,event,entities,reported_metric,market_health_signal,source
2015,AirBit Club founded,AirBit Club; Pablo Renato Rodriguez; Gutemberg Dos Santos,DOJ said Rodriguez and Dos Santos co-founded AirBit Club in 2015,Start of the membership and claimed crypto trading/mining business,DOJ Rodriguez sentencing release
2015 onward,Memberships marketed through MLM structure,AirBit Club; promoters,DOJ said AirBit was marketed as a multilevel marketing club in the cryptocurrency industry,Recruitment growth needed separation from real market profit,DOJ Rodriguez sentencing release
2016 onward,Withdrawal friction reported,AirBit Club; investors,DOJ said some withdrawal attempts met excuses delays and hidden fees above 50 percent,Displayed balances required actual redemption testing,DOJ AirBit case page
2017 to 2018,Algorithmic day-trading promotion alleged,Karina Chairez; AirBit Club,SEC alleged high-return claims from automated robots connected to international exchanges,Trading-bot claims required venue and execution proof,SEC administrative order 95619
2020,Charges unsealed,AirBit Club defendants,DOJ announced charges for fraud and money laundering tied to AirBit Club,Government record formalized the mismatch between claims and funds,DOJ AirBit case page
2020-04,Portal account closure excuse described,AirBit Club; investor,DOJ said one portal account was closed under a purported COVID-19 reserve policy,Platform policy explanation became a redemption-failure signal,DOJ Rodriguez sentencing release
2023-03,Guilty pleas announced,AirBit Club operators promoters and attorney,DOJ announced guilty pleas and forfeiture of proceeds including currency Bitcoin and real estate valued around 100 million USD,Admissions and forfeiture strengthened the trading/mining falsity record,DOJ guilty plea release
2023-09-26,Rodriguez sentenced,Pablo Renato Rodriguez,DOJ announced a 12-year prison sentence and 65 million USD forfeiture order,Criminal outcome confirmed the scheme's false crypto investment claims,DOJ Rodriguez sentencing release
2023-10-03,Additional prison sentences announced,Scott Hughes; Cecilia Millan; Karina Chairez,DOJ announced sentences of 18 months five years and one year plus one day,Operator and promoter outcomes reinforced the enforcement finding,DOJ operator sentencing release
