time_utc,signal,observed_value,derived_metric,market_health_meaning,source_url
2024-03-05 15:42:06,first_attack_transaction,"Arbiscan transaction 0x57e555328b7def90e1fc2a0f7aa6df8d601a8f15803800a5aaf0a20382f21fbd succeeded with 45 logs and 24 ERC-20 transfers","T+0 seconds","Start the response clock from first abnormal WOO sPMM execution, not from public acknowledgement",https://arbiscan.io/tx/0x57e555328b7def90e1fc2a0f7aa6df8d601a8f15803800a5aaf0a20382f21fbd
2024-03-05 15:42:22,first_forta_alert,"Forta reports first alert about 16 seconds after the first attack transaction","T+16 seconds","External detection arrived early enough to support automated pause logic",https://www.forta.org/blog/wootrade-hack-detected-in-advance-by-forta-4-8m
2024-03-05 15:49:29,second_attack_transaction,"Arbiscan transaction 0x40e1b8c78083fc666cb7598efcecd0ae0af313fc41441386e4db716c2808ce07 succeeded with 51 logs and 28 ERC-20 transfers","7 minutes 23 seconds after first transaction","Same-pattern repetition should raise severity before cumulative losses expand",https://arbiscan.io/tx/0x40e1b8c78083fc666cb7598efcecd0ae0af313fc41441386e4db716c2808ce07
2024-03-05 15:53:58,third_attack_transaction,"Arbiscan transaction 0xe80a16678b5008d5be1484ec6e9e77dc6307632030553405863ffb38c1f94266 succeeded with 54 logs and 30 ERC-20 transfers","11 minutes 52 seconds after first transaction","Escalation should block repeat execution by the same labelled account and asset path",https://arbiscan.io/tx/0xe80a16678b5008d5be1484ec6e9e77dc6307632030553405863ffb38c1f94266
2024-03-05 16:02:00,contracts_paused,"WOOFi says affected smart contracts had been paused by 16:02 UTC","About 19 minutes 54 seconds after first transaction","Pause capability existed, but automated response timing determines saved funds",https://woox.io/blog/woofi-spmm-exploit-post-mortem
2024-03-05,borrowed_inventory,"WOOFi says the exploiter borrowed about 7.7M WOO plus other assets before selling WOO into WOOFi","Borrowed inventory funded the manipulated flow","Monitor borrowed inventory against venue depth and same-transaction price impact",https://woox.io/blog/woofi-spmm-exploit-post-mortem
2024-03-05,near_zero_spmm_price,"WOOFi says the sPMM adjusted WOO far outside the expected range to $0.00000009","Internal price collapsed toward zero","Near-zero synthetic price for a live token should fail closed",https://woox.io/blog/woofi-spmm-exploit-post-mortem
2024-03-05,cheap_woo_extraction,"WOOFi says the attacker swapped out 10M WOO in the same transaction with almost no cost","10M WOO extraction after price collapse","Do not allow a model-distorting sell leg to immediately enable an oversized buy leg",https://woox.io/blog/woofi-spmm-exploit-post-mortem
2024-03-05,repeated_pattern,"WOOFi and Forta both describe the pattern as repeated three times within minutes","Three-round execution","Repeated same-account pattern is a circuit-breaker signal even before final accounting",https://www.forta.org/blog/wootrade-hack-detected-in-advance-by-forta-4-8m
2024-03-05,estimated_profit,"WOOFi and Forta report about $8.75M in profit after returning flash loans","Public postmortem loss/profit estimate","Profit accounting confirms economic materiality; controls should trigger earlier on price-state anomalies",https://woox.io/blog/woofi-spmm-exploit-post-mortem
2024-03-05,automated_response_value,"Forta estimates automated incident response could have saved up to $4.8M","Potential mitigation value","Alert-to-action latency is an economic risk metric, not only an operations metric",https://www.forta.org/blog/wootrade-hack-detected-in-advance-by-forta-4-8m
