signal,observation,market_health_use,source
whale_borrow_exposure,"Decrypt summarized that the Solend whale had borrowed about $108 million in USDC and USDT against a large SOL deposit","Track largest-borrower exposure against total market liquidity","https://decrypt.co/103489/solend-whale-108m-loan-nearly-crashed-solana"
emergency_account_control,"CoinDesk reported that Solend users voted on emergency authority for Solend Labs to temporarily control the whale account","Flag governance proposals that grant account-specific intervention powers","https://www.coindesk.com/tech/2022/06/19/solana-defi-platform-votes-to-control-whale-account-in-bid-to-avoid-liquidation-chaos"
proposal_reversal,"The Crypto Times reported that a later proposal invalidated the whale-account takeover plan after backlash","Monitor rollback votes and legitimacy stress after emergency actions","https://www.cryptotimes.io/2022/06/20/solanas-defi-platform-invalidates-whale-account-takeover-proposal/"
fund_movement,"The Crypto Times reported that the whale account began moving funds after the emergency governance controversy","Track whether whale position migration reduces liquidation pressure before forced execution","https://www.cryptotimes.io/2022/06/21/solend-protocol-whale-account-starts-moving-funds/"
public_confidence,"Web3 is Going Great summarized the Solend account-control episode as a governance and liquidation controversy","Combine governance sentiment with withdrawal pressure and market-depth monitoring","https://web3isgoinggreat.com/?id=solend-tries-to-take-over-whale-wallet"
