date,event,metric_signal,source
2020-05_to_2020-08,"Todd allegedly attempted to pump DGTX using a bot on third-party exchanges that was designed to buy more than it sold.","Persistent net buying by an interested party can support a token price even when the trading loses money.","https://www.cftc.gov/PressRoom/PressReleases/8748-23"
2020-05_to_2020-08,"Todd allegedly filled large over-the-counter DGTX purchase orders on third-party exchanges rather than out of the Digitex treasury.","Routing buyer demand through public markets can create visible price impact instead of an off-market treasury transfer.","https://www.cftc.gov/PressRoom/PressReleases/8605-22"
2020-05_to_2022-05,"Digitex Futures required users to deposit DGTX into accounts to margin futures trading, according to the CFTC.","Native-token utility can create a platform incentive to defend public market price.","https://www.cftc.gov/PressRoom/PressReleases/8748-23"
2022-09-30,"The CFTC filed its complaint against Todd, Digitex LLC, Digitex Limited, Digitex Software Limited, and Blockster Holdings.","Civil enforcement identified attempted manipulation of DGTX and registration failures.","https://www.cftc.gov/media/7826/enfdigitexcomplaint093022/download"
2023-07-05,"A federal court issued a default judgment granting a permanent injunction.","The court resolved the action and imposed trading and registration bans.","https://www.cftc.gov/PressRoom/PressReleases/8748-23"
2023-07-12,"The CFTC announced more than $15 million in ordered payments, including $3,912,220 in disgorgement and $11,736,660 in civil monetary penalty.","Final sanctions quantify the cost of attempted native-token price manipulation and related violations.","https://www.cftc.gov/PressRoom/PressReleases/8748-23"
