signal,observation,market_health_use,source
dai_price_spike,"Compound forum records state that DAI reached $1.30 on Coinbase Pro during the November 2020 event","Track oracle-source stablecoin premiums against broad-market peg prices","https://www.comp.xyz/t/dai-liquidation-compensation/684"
liquidation_volume,"Decrypt reported about $89 million in loans liquidated on Compound after DAI traded at a roughly 30% premium on Coinbase","Measure borrower losses caused by oracle-source dislocations","https://decrypt.co/49657/oracle-exploit-sees-100-million-liquidated-on-compound"
oracle_source_concentration,"ForkLog reported that Compound's oracle used Coinbase price data and that the DAI-denominated debt rose when Coinbase DAI spiked","Monitor dependence on single reference venues for liquidation-critical assets","https://forklog.com/en/dai-price-spike-on-coinbase-triggers-100m-liquidations-on-compound/"
community_compensation,"Compound opened a dedicated compensation discussion for users borrowing DAI who were liquidated on November 25-26","Track governance recovery decisions after oracle-triggered liquidation events","https://www.comp.xyz/t/dai-liquidation-compensation/684"
event_analysis,"Compound community discussion debated whether the Coinbase Pro price was fair, manipulated, or an oracle-design failure","Classify incident hypotheses before treating liquidations as ordinary market risk","https://www.comp.xyz/t/dai-liquidation-event/642"
