event_date,event,entities,reported_metric,market_health_signal,source
2022-07,Pool scheme begins,Michael Griffis; Amanda Griffis; Blessings Thru Crypto,CFTC said the pool scheme operated from about July 2022 through January 2023,Pool formation required registration and custody checks,CFTC press release 8757-23
2022-2023,Participant funds solicited,Blessings Thru Crypto; Blessings of God Thru Crypto,CFTC said over 100 people sent more than 6 million USD to participate,Deposits needed pool-to-platform reconciliation,CFTC press release 8757-23
2022-2023,Apex trading story promoted,Apex Trading Platform; Coach Wendy,Participants were told funds would trade crypto futures on Apex Trading Platform with Coach Wendy advice,Platform name and adviser required independent proof,CFTC press release 8757-23
2022-2023,Apex-route funds lost,Apex Trading Platform,CFTC said over 4 million USD purportedly sent to Apex moved to wallets outside defendants control and beyond recovery,Fund flow contradicted represented trading path,CFTC press release 8757-23
2022-2023,Personal-expense diversion,Michael Griffis; Amanda Griffis,CFTC said about 1 million USD was misappropriated for debts jewelry and an all-terrain vehicle,Personal leakage undermined pool-performance claims,CFTC press release 8757-23
2022-2023,Ponzi-like payments,Blessings Thru Crypto,CFTC said remaining funds were used for Ponzi-like payments,Payouts needed tracing to realized gains,CFTC press release 8757-23
2023-07-25,CFTC charges announced,CFTC; Michael Griffis; Amanda Griffis,CFTC charged fraud and failure to register in connection with the commodity pool,Public enforcement challenged safety and trading claims,CFTC press release 8757-23
2025-09-25,CFTC announces consent order,CFTC; Michael Griffis; Amanda Griffis,CFTC announced 5.528121 million USD restitution and 1.355232 million USD civil monetary penalty,Final relief quantified victim harm and penalties,CFTC press release 9133-25
