event_date,event,entities,reported_metric,market_health_signal,source
2020-09,SEC relevant period begins,MyConstant; CONST LLC; Huynh Tran Quang Duy,SEC order said the offering period began in September 2020,Product and fund-flow controls needed records from launch,SEC administrative order
2020 to 2022-11,Crypto lending products offered,MyConstant,MyConstant offered fixed returns from crypto-backed loan products,Fixed-yield claims needed loan and collateral reconciliation,SEC administrative order
2020 to 2022-11,Funds raised,MyConstant; investors,SEC order said more than 20 million USD was raised from more than 4000 investors,Deposit flows needed product-to-asset mapping,SEC administrative order
2020 to 2022-11,Fixed return marketed,MyConstant,SEC order said investors were offered returns of 6 percent to 10 percent,Yield needed borrower interest and collateral proof,SEC administrative order
2022-05,TerraUSD collapse,TerraUSD; UST,SEC order found some investor funds were used to buy UST before the algorithmic stablecoin collapsed,UST exposure created protocol and liquidity risk,SEC administrative order
2022-12-21,California DFPI order announced,DFPI; MyConstant,DFPI ordered CONST LLC doing business as MyConstant to desist and refrain from offering crypto-related products in California,State order challenged product legality and disclosures,DFPI press release
2025-08-05,SEC order issued,SEC; Huynh Tran Quang Duy,SEC ordered 8364508 USD disgorgement 1575238 USD prejudgment interest and 750000 USD penalty,Federal order fixed disgorgement interest and penalty,SEC administrative order
