signal,date,venue_or_protocol,severity,unit,source,note
settlement_value_at_risk,2025-03-25,Polymarket,5,model_threshold,https://crypto.report/hacks-exploits/polymarket-faces-blowback-over-oracle-manipulation-allegations/,Disputed prediction-market payout value becomes a direct target when final settlement is controlled by an oracle vote
oracle_capture_ratio,2025-03-25,UMA Optimistic Oracle,5,model_threshold,https://www.coinrank.io/crypto/polymarket-oracle-crisis-puts-decentralized-prediction-markets-at-a-crossroads/,Critical band when estimated oracle influence cost is lower than settlement value at risk
voter_concentration,2025-03-25,UMA,5,qualitative,https://www.panewslab.com/en/articles/n7qbr7q226xv,Large governance voters can dominate resolution when token-weighted dispute turnout is concentrated
dispute_round_count,2025-03-25,UMA Optimistic Oracle,4,qualitative,https://www.coinlive.com/news/the-value-of-ai-oracles-from-the-polymarket-oracle-manipulation,Repeated proposal-dispute cycles indicate weak factual convergence and higher settlement-risk pressure
evidence_latency,2025-03-25,Prediction Markets,4,model_threshold,https://journalducoin.com/defi/catastrophe-polymarket-attaque-manipulation-oracle-uma/,Ambiguous real-world evidence near the resolution deadline increases oracle manipulation surface
trust_contagion,2025-03-26,Polymarket,4,qualitative,https://crypto.report/hacks-exploits/polymarket-faces-blowback-over-oracle-manipulation-allegations/,A disputed high-profile settlement can widen spreads and weaken liquidity confidence across unrelated markets
