event_date,event,entities,reported_metric,market_health_signal,source
2018-01 to 2019-01,Digital-asset trading solicitation alleged,Thomas J. Gity; investors,SEC alleged investor money was solicited for digital-asset trading,Trading claims required deposit trade and P&L records,SEC litigation release
2018-01 to 2019-01,Investor funds received,Thomas J. Gity; investors,SEC alleged at least 6.8 million USD received from at least 18 investors,Investor scale required account-level ledgers and source-of-funds tracing,SEC litigation release
scheme period,Claimed AUM and weekly return,Thomas J. Gity,SEC said complaint alleged more than 100 million USD in managed digital assets and weekly returns up to 46.83 percent,AUM and returns required independent custody and account verification,SEC harmed-investor page
scheme period,Trading-account deposits alleged,Thomas J. Gity; digital asset trading accounts,SEC alleged less than 970000 USD was deposited into digital-asset trading accounts,Capital deployment did not match trading narrative,SEC harmed-investor page
scheme period,Ponzi-like use alleged,Thomas J. Gity; investors,SEC alleged funds were used for personal expenses or to pay other investors in a Ponzi-like fashion,Distributions needed tracing to trading profits rather than new investor funds,SEC harmed-investor page
2020-09-29,SEC complaint filed,SEC; Thomas J. Gity,SEC filed civil complaint in Southern District of Florida,Enforcement action documented alleged account-statement and trading failures,SEC litigation release
2021-06-21,Final judgment by consent entered in part,Thomas J. Gity,Court entered final judgment by consent against Gity in part,Judgment-stage relief began,SEC harmed-investor page
2021-09-23,Final monetary judgment by consent entered,Thomas J. Gity,Court ordered 5111131.52 USD total in disgorgement interest and civil penalty,Final judgment quantified monetary relief against Gity,SEC harmed-investor page
2022-12-20,Harmed-investor distribution page published,SEC; harmed investors,SEC page summarized allegations final judgments and investor distribution process,Distribution process summarized final remedies and alleged investor harm,SEC harmed-investor page
