signal,observation,market_health_use,source
titan_collapse,"CoinDesk reported TITAN fell from above $60 to near zero during panic selling","Track share-token drawdown as a stablecoin collateral risk metric","https://www.coindesk.com/markets/2021/06/17/iron-finances-titan-token-falls-to-near-zero-in-defi-panic-selling"
iron_depeg,"IRON traded below its intended $1 peg during the TITAN collapse","Measure stablecoin discount during share-token stress","https://www.coindesk.com/markets/2021/06/17/iron-finances-titan-token-falls-to-near-zero-in-defi-panic-selling"
redemption_impairment,"CoinDesk reported redemptions were disabled automatically due to the drop in TITAN's price","Detect whether the primary peg-defense path remains available during a run","https://www.coindesk.com/markets/2021/06/17/in-token-crash-postmortem-iron-finance-says-it-suffered-cryptos-first-large-scale-bank-run"
fractional_collateral,"CoinDesk analysis described IRON as roughly 75% USDC-backed and 25% backed by TITAN","Separate hard collateral from volatile share-token backing","https://www.coindesk.com/policy/2021/06/17/paying-the-iron-price-fractional-reserve-banking-on-a-blockchain"
liquidity_exit_dynamic,"Public coverage described large holders selling and liquidity exits accelerating the panic","Monitor whale exits and pool depth before stablecoin discounts deepen","https://www.coindesk.com/markets/2021/06/17/iron-finances-titan-token-falls-to-near-zero-in-defi-panic-selling"
