event_date,event,entities,reported_metric,market_health_signal,source
2018,Scheme begins,William Koo Ichioka; Ichioka Ventures,CFTC said the fraudulent scheme began in 2018,Performance records needed reconstruction from first deposits,CFTC press release 8970-24
2019-08,Ichioka Ventures LLC formed,Ichioka Ventures LLC; William Koo Ichioka,CFTC complaint said Ichioka Ventures LLC was formed in August 2019,Entity formation needed registration and pool-structure review,CFTC complaint
2018 to 2022-05,Participants solicited,Ichioka Ventures; pool participants,CFTC alleged solicitation of more than 100 individuals and entities,Participant count required formal ledgers and custody controls,CFTC complaint
2018 to 2022-05,Return claim promoted,Ichioka Ventures,CFTC said website described 30 business day term with 10 percent return,Fixed short-period returns needed realized-P&L support,CFTC press release 8727-23
2023-06-22,CFTC complaint filed,CFTC; William Koo Ichioka,CFTC charged Ichioka with soliciting and misappropriating more than 21 million USD,Public enforcement challenged return and fund-use claims,CFTC press release 8727-23
2023-08-14,Initial consent order entered,William Koo Ichioka; CFTC,CFTC said court entered permanent injunction trading ban and registration ban,Order restricted future market access,CFTC press release 8970-24
2024-09-19,Supplemental monetary order entered,William Koo Ichioka,Court ordered 31330715.86 USD restitution and 5000000 USD civil monetary penalty,Final monetary relief quantified restitution and penalty,CFTC supplemental consent order
2024-09-20,CFTC announces final civil monetary relief,CFTC; William Koo Ichioka,CFTC announced more than 36 million USD in monetary relief,Final civil resolution fixed market-harm measurement,CFTC press release 8970-24
2024,Criminal sentence referenced,William Koo Ichioka,CFTC release said Ichioka was sentenced to 48 months in prison and 5 years supervised release,Parallel criminal case confirmed misconduct severity,CFTC press release 8970-24
