signal,date,venue_or_protocol,severity,unit,source,note
regulatory_wind_down_deadline,2023-04-30,Bittrex U.S.,high,deadline,https://www.bankingdive.com/news/us-arm-of-crypto-exchange-bittrex-files-for-bankruptcy/649823/,Customers who did not withdraw before the U.S. shutdown deadline moved into a court-mediated access path.
bankruptcy_gated_withdrawal_access,2023-05-08,Bittrex U.S.,critical,legal_access,https://www.bankingdive.com/news/us-arm-of-crypto-exchange-bittrex-files-for-bankruptcy/649823/,Bittrex filed for bankruptcy and planned to ask the court to reopen accounts for remaining customers.
government_objection_risk,2023-06-08,Bittrex U.S.,high,legal_objection,https://www.cryptotimes.io/2023/06/08/bankrupt-bittrexs-proposal-faces-legal-challenge/,A U.S. government objection challenged Bittrex's proposal to return customer funds.
court_withdrawal_authorization,2023-06-14,Bittrex U.S.,medium,court_order,https://www.cryptotimes.io/2023/06/14/bittrex-u-s-enables-withdrawals-as-bankruptcy-process/,A Delaware court authorized withdrawals for customers with qualifying claims.
claim_qualification_filter,2023-06-15,Bittrex U.S.,medium,claim_status,https://unchainedcrypto.com/bankrupt-crypto-exchange-bittrex-u-s-to-enable-withdrawals/,Withdrawals depended on undisputed and liquidated customer claim status.
plan_confirmation_state,2023-10-31,Bittrex U.S.,medium,bankruptcy_plan,https://www.cryptotimes.io/2023/10/31/bankruptcy-court-permitted-bittrex-to-close-us-operations/,Bankruptcy court approval allowed the U.S. operations wind-down plan to proceed.
court_opinion_reference,2024-01-01,Bittrex U.S.,medium,legal_record,https://www.deb.uscourts.gov/sites/deb/files/opinions/Bittrex%20Ghader%20Opinion.pdf,The bankruptcy court opinion documents customer-claim classes and plan treatment.
